Product ID,Product Name,Category,Description,Price
470,Nizami Hyderabadi Cuisine,Gourmet & World Food,"It was in the kitchens of the erstwhile Nizams of Hyderabad where cultures truly blended together by taking the best of each other – be it Arabic, Mughal, Turkish or South Indian. Like most of India’s cities, Hyderabad is a blend of fairy-tale and reality, a motley mix of the old and the new, forming an exotic background for it’s much sought after and mouth-watering cuisine. Since this spice blend was meant for the palate of the Royals, the recipe and ingredients were under guard and preparation techniques confined to the secrecy of the Palace Kitchens. Through Afifa Begum, we at Junyali are proud to be able to present to you the Nizami Spice Blend directly from the Royal household. It has been refined so that it can be used for all Nizami cuisine! Ghee and slow cooking is always recommended.",395
471,Elegance Deodorizing Talc - For Men,Beauty & Hygiene,"This luxury perfumed talc leaves your skin feeling soft and fragrant throughout the day. The fragrance will keep you refreshed and comfortable. The rich and the authentic fragrances from the house of Yardley, which will keep you energizing and rejuvenating.",185
472,"LED Bulb - 10 Watt CDL Round Base Lyor 5 Star Series, Cool Day Light White, B22","Kitchen, Garden & Pets",Crompton presents a 5 star LED lamp that adds to the design and comfort of your house. If you have frequent voltage fluctuations then do not worry as this lamp has a voltage fluctuation guard. This energy-efficient 10-watt lamp comes with a year warranty.,285
473,Organic Rasam Ready Mix - Long Pepper,Snacks & Branded Foods,"This is a healthy form of Rasam which is made from Long Peppers. Long Peppers has been proven as prevention of many forms of cancers. This can be consumed as soup. Long peppers help in bronchitis, asthma, increases immunity, improves digestion and remove toxins. Certified organic products are only used.",85
474,Gold Caramel Candy,Snacks & Branded Foods,"Your trusted brand, Alpenliebe is known for its exceptionally smooth and creamy, melt-in-your-mouth qualities. Full of milky richness, Alpenliebe Gold is a fun-filled candy to have at any time of the day. Show your loved ones how much they mean to you by sharing Alpenliebe candies with them. Alpenliebe – bring hearts closer",50
475,Masala - Birayani Pulao,"Foodgrains, Oil & Masala",Mdh Briyani Masala Is An Aromatic Mix Of Spices. It Made Up Of Quality Of Ingredients. It Can Be Used To Make Exotic Briyani.,80
476,Hair Fall Control Oil,Beauty & Hygiene,"Dr Batra’s Hair Fall Control Oil contains Tulsi extract, Brahmi Oil and Thuja. Enriched with the goodness of Tulsi extract stimulates the proliferating cells in the hair root. Brahmi Oil strengthens hair roots by providing nutrition. Thuja controls hair loss. The Hair Oil nourishes the hair cuticles without a feeling of sticky or heavy. It has a very soothing calming effect not only on hair but also on the nervous system. Its natural ingredients prevent hair loss and boost hair growth.All Dr Batra’s Products are formulated with natural actives. The proportion of surfactants in Dr Batra’s Hair Care Products is much lower, as compared to other cosmetic products, thus protecting the scalp and hair from chemical damage. Dr Batra’s Hair Care Products does not contain SLS & Paraben (a very harmful and carcinogenic).",290
477,Bio Renew White Strawberry & Sweet Mint Conditioner,Beauty & Hygiene,"Gently condition your hair with Herbal Essence's bio-renew White Strawberry & Sweet Mint Conditioner to leave it voluminous and vibrant. Crafted with bio-renew, our signature blend of essential antioxidants, aloe and sea kelp, White Strawberry & Sweet Mint Conditioner also helps purify and protect against impurities to bring your hair back to life. Free of parabens, gluten and colourants, White Strawberry & Sweet Mint Conditioner gently conditions as it infuses crisp notes of white strawberry, delicate jasmine and invigorating mint into your hair.",650
478,"Comfort Bathroom Stool Plastic/Patla - Plain, Big, Assorted",Cleaning & Household,Joyo Patla is a portable furniting item used for sitting. It can also be used in bathrooms to facilitate bathing or for washing clothes while sitting on it. It is made of strong and durable material and is easy to carry around.,426
479,Bounce Biscuits - Elaichi Creme,Snacks & Branded Foods,"Deliciously creamy and deliciously fun - Sunfeast Bounce. These biscuits are available in four tasty flavours- Chocolate, Orange, Elaichi and Pineapple. The flavoured biscuit shell encasing the soft creamy centre transports you to a world of fun and excitement!",30
480,"Pumice Stone & Emery Foot Filer - FFL3407, Colour May Vary",Beauty & Hygiene,,175
481,Olive Oil - Classic,Gourmet & World Food,"The La Espanola pure Olive oil is primarily refined olive oil with a small addition of virgin for taste. It has a superior aroma and flavour that is ideal for daily Indian cooking. Our pure olive oil has strong Anti-Inflammatory properties, large amounts of antioxidants and multiple health benefits. Use a drizzle of the La Espanola pure Olive oil for cooking or as a dressing on salads to keep your heart health in check. It contains zero trans fat and cholesterol. Packed with the goodness of antioxidants, olive oil is a rich source of vitamin E and supports your metabolism. Drizzle, dress or pour our olive oil to enjoy the deliciousness of hearty Italian cooking. A healthier pick than vegetable and seed oils, our olive oil is neutral in taste and can be used for all types of Indian cooking including deep frying, roasting etc.",1350
482,Light Soy Sauce - Reduced Salt,Gourmet & World Food,"Tai Hua soy sauces are traditional Chinese flavoured soy sauces, naturally brewed from selected premium soy beans, wheat flour, water and salt. Tai Hua Sauce has well-balanced flavours of saltiness, sweetness and tartness. Ideal to cook food or use as a dip. Tai Hua Soy sauces are manufactured in Singapore.",385
483,"Kitchen Cleaning/Dusting Microfibre Cloth - Red & Grey, G130064RG",Cleaning & Household,"Keep your kitchen tidy and clean with these red and grey coloured microfibre cloth. Since the cloth is made using microfibre, it can absorb more water than its weight. It is easy to clean and dry. It traps dirt like a magnet. The fibres are super soft hence makes the cleaning ultra smooth and relaxing. It's a pack of six.",258
484,Painting Kit,Cleaning & Household,"Doms Painting Kit is a perfect value kit that comes in a convenient and attractive pack. It is a perfect kit with assorted products suitable to gift your children, their friends or students. It is suitable for beginners to start painting. The kit contains a Drawing Book, 12 Shade Bi-Colour Pencil, 12 Shade Oil Pastels, 12 Shade Water Colour Pens, Water Colour Cake Pack, 6 Shade Glitter, 12 Shade Extra Long Wax Crayon and a Pencil Kit.",199
485,Diamond Skin Brightening Kit - Consumer Pack,Beauty & Hygiene,"Joy Diamond Brightening Facial Kit contains Diamond Ash and Natural Extracts to make skin brighter and polished. It brings out radiance and shining effect of the skin. Step 1: Joy Diamond Scrub Cleanser: Enriched with Diamond Ash, Vitamin E, Wheatgerm and Almond oil, this unique scrub cleanser effectively cleanses the skin to reveal natural brightness. It revitalizes and rejuvenates skin. Step 2: Joy Diamond Skin Brightening Cream: Contains Diamond Ash and natural moisturisers which improve the skin’s ability to retain moisture and hydrate itself. The skin’s resilience and elasticity improves, making it supple and firm. Step 3: Joy Diamond Youthful Shine pack: Detoxifying shine pack removes dead skin cells and regenerates new cells to provide glow and youthful shine. Extracts of Aloe, Almond, Hops, Evening Primrose and Gotu Kala increases the vitality of skin by preventing early wrinkles and lines Step 4: Joy Diamond Polish Cream: Zero Oil Cream forms an invisible layer on the skin thereby protecting it from environmental pollution, impurities and UV rays. It imparts a smooth and bright complexion that lasts all day.",250
486,Organic - Turmeric Powder/Arisina Pudi,"Foodgrains, Oil & Masala","Turn Organic brought to you its Premium, fresh and healthy Organic Turmeric Powder with no added pesticides and fertilizers. Popularly known as Haldi, commonly used as a spice in Indian cuisine and even curries, for dyeing, and to impart color to mustard condiments.",40
487,Natural Neem Agarbatti,Cleaning & Household,"Goodknight Naturals Neem Agarbatti, a 100% natural mosquito repellent agarbatti (incense stick). Goodknight Agarbatti is infused with nature's two most potent natural ingredients - Neem and Turmeric which can repel mosquitoes and provide effective mosquito protection.",180
488,Raspberry Strawberry Preserve,Gourmet & World Food,"Luscious Raspberries and Juicy Strawberries Blend Together to make this Delightful Preserve That's a Hit with Everyone, Perfect for a Delicious Breakfast and Also for Your Desserts",349
489,Meghdoot Honey Almond Body Lotion,Beauty & Hygiene,"Meghdoot Honey Almond Body Lotion is enriched with honey, aloe vera and oil extracts of almond that helps attain young soft and glowing skin by reducing skin pigmentation and wrinkles. It also helps reduce excessive dry skin. It has the perfect balance of almond oil and honey along with aloe vera. This lotion deeply nourishes and moisturises your skin making it smooth and youthful. It keeps your skin healthy and naturally glowing.",195
490,Hajmola Maha Candy - Aam+Imli,Beauty & Hygiene,"Hajmola Maha Candy is a zingy tangy candy thats fun to have any time of the day. And whats more, it gets your digestive juices working better.

Its a great way to enjoy while staying healthy. The Candys khatta meetha taste is available in two different fun-filled flavours- Albela Aam and Chulbuli Imli  For Beauty tips, tricks & more visitÃ‚ https://bigbasket.blog/",130
491,Rice Bran Oil,"Foodgrains, Oil & Masala","Fortune Rice Bran Health Oil is physically refined oil, it contains Gamma Oryzanol, that reduces cholesterol, keeps heart healthy.
Vitamin E helps in maintaining the balance of the nervous system, natural antioxidants.
Best suitable for health conscious people.",215
492,"N95 Washable Face Mask - Blue, Medium",Beauty & Hygiene,"Nirvana's N95 washable masks give protection against 96% of germs and contaminants. This anti-viral mask is designed with 3 layers to keep you guarded against the harmful bacterias and viruses. The outer and inner layers are made from all-natural fabrics like cotton, linen, hemp, and flax, and a nanofibre filter is placed in the middle to provide maximum protection against particulate matter and contaminants.
The filtering efficiency of a mask depends on its proper fit. Nirvana masks have an adjustable secured noseband that always ensures perfect fitting and comfort. It is available in three different sizes (small, medium, and large). Medium Size fits a person weighing between 35 Kg to 65 Kg.",395
493,Coriander Powder,"Foodgrains, Oil & Masala","Patanjali Coriander Powder is the powder obtained by grinding clean, sound, dried mature fruits of Coriandrum Sativum. Add it to bring the aromatic taste of coriander to your food.",24
494,Dressing - Creamy Caesar,Gourmet & World Food,"Vegetable Oil (Soybean and/or Canola), high fructose corn syrup distPickle relish (Cucumber, distilled vinegarm, water, Salt, Xanthan gum, alum), High Fructose Corn Syrup, Water, Cucumber Juice, Tomato Paste, Sugar, Distilled Vinegar, egg Yolk, Contain less tahn 2% of Salt, modified food starch, natural flavor, Spices (catsup Seasoning, allspice, ginger, mustard flour, tumeric), Onion Powder, Propylene glycol alginate, Xanthan gum, Calcium disodium EDTA to Protect flavour, Caramel color.",270
495,Shishu Taila - For Healthy Skin & Stronger Bones,Beauty & Hygiene,"Massaging infants has various health benefits and it is a beautiful way of expressing your love and are to them. It is necessary to protect, hydrate and moisturize baby's skin since the beginning. Sri Sri Tattva Shishu Taila is a wonderful blend of exquisite herbs prepared by restoring the essence of Traditional Ayurvedic oil. Suitable for a newborns skin, this oil helps to protect & nourish it effectively. It also helps strengthen infant's bones. Keep the delicate skin of your baby healthy&.ftwithSriSriTattvaShishuTaila.Protects & nourish the baby’s skin.Therapeutic uses: good for the skin.Improves complexion.Reduces skin dryness due to Vata dosha in winter.ItchingGood for hair.Cuts or wounds.Cracked skin.Strengthens tissues & bones.Nourishes tissues.Burning sensation caused by pitta vitiation in summer.",200
496,Chocolate Flavoured Lubes,Beauty & Hygiene,SKORE Lubes is specifically aimed at enhancing your foreplay sessions and promises to drive you and your partner wild with pleasure. Now Foreply in new Chocolate flavour.,300
497,Free Range Eggs - Omega 3,"Eggs, Meat & Fish","Happy Hens Farms Eggs are from chickens feed on herbs, grains, in addition to bugs, greens and others in the range which enriches the eggs uniquely. These are providing the strength and energy to patients. Our eggs are hygienically processed and also safely packed for keeping these free from any contamination and impurity. It contains rich nutritional content, protein, rich taste and the fragrance.",150
498,Whiteglow Skin Whitening & Brightening Gel Creme PA+++ - SPF 25,Beauty & Hygiene,"Lotus Herbals Whiteglow Skin Whitening & Brightening Gel Cream SPF-25 is an apt product to help you fight the stern rays of the sun and remain tan free for a long period of time, thanks to its SPF 25 PA+++ formulation. It has a one of its kind base that has the amazing combination of a gel and a cream. This unique base facilitates fast absorption, leaving you with youthful looking supple skin that radiates brightness. The mulberry, saxifrage and grape extracts help make the skin brighter, override the harmful effects of skin darkening and lend a beautiful texture to the skin surface post application. Its milk enzymes act as natural fairness agents and lighten the skin tone with a visible difference. You can now effectively tackle the harmful effects of both UVA and UVB on applying this cream.Tip: Following a regular skin care regime can help you achieve flawless skin. For more tips on skin care, visit bigbasket lifestyle blog, Click Here to visit bigbasket’s lifestyle blog",390
499,Premium Californian Roasted & Salted Pistachios - Value Pack,Gourmet & World Food,"Happilo has travelled the world to get the finest gourmet dry fruits, Pistachios are a wonderful, fun and tasty snack, which are lightly salted. Crack open the shells to treat your taste buds for a snacking sensation.",875
500,Active Baby Medium (6-11 kg) - 62 Diapers,Baby Care,"Pamper Active Baby Medium Diapers have been planned to offer utmost comfort to your kid. It keeps your baby dry, even under stress, so he can play uninterruptedly. It is flex to fit where your baby needs it nearly all.",1099
501,Nutrition & Health Drink - Pista Badam,Beverages,"Complan is a scientifically developed nutrition and health drink with clinically proven formula to give kids’ 2 times faster growth. This milk protein-based formula also supports immune function, helps brain development & functioning. Serve Complan to your kid two times a day as part of their daily balanced diet and help your children grow 2 times faster. Available in 4 delicious flavours - Royale Chocolate, Creamy Classic, Kesar Badam and Pista Badam.Complan is a nutrition and health drink with clinically proven formula to deliver 2 times faster growthContains 100% First Class ProteinContains 34 Vital NutrientsNutrients like Vitamin A, E &C supports immune functionNutrients like Iodine, Iron, Vitamin B12 and Folic Acid helps Brain development and it’s functioningNutrients like Sodium, Potassium & Chloride maintains fluid balance in the bodyCan be consumed with milk or water",315
502,Chocolate Biscuits - Cream 4 Fun,Snacks & Branded Foods,Dukes Bourbon Biscuits are not only tasty; it has the goodness of chocolate taste. It gives real aroma of chocolates makes you go enticing and induce you to take bites over and over. Each bite of this biscuit is a delicacy for your taste buds.,30
503,Oat Krunch - Dark Chocolate,Gourmet & World Food,"Moments with crackers have a special place in our lives, bringing us and our families warmly together every day during breakfast, tea or any time you need a munch. It is the ideal product for everyday snacking, and Munchy's Crackers have made it easier than ever. Oat Krunch is Higher in Wholegrain, Trans-fat free with No Preservatives. Made from the Natural goodness of Oats. Packed in a convenient sachet, Oat Krunch is a great snacking companion wherever you go.
 Benefits :
1. Crackers are generally low in calories.
2. They are a rich source of B-Complex vitamins and dietary fibre.
3. They are a good source of energy.",125
504,Soft & Fresh Soap Bar,Beauty & Hygiene,"Pears Soft & Fresh Soap is a multi-purpose soap that cleans your skin and keeps it supple all the time. True to its name, the soap gives you a soft and fresh skin instantly.Its active ingredients moisturize your skin from deep within and keeps it looking clean and the pure glycerin and mint extracts give it an instant cool freshness. Give yourself a refreshing shower every day, buy the Pears Soft & Fresh Soap Bar, right here!  For Beauty tips, tricks & more visit https://bigbasket.blog/",72
505,Oxygen Moisture Shampoo,Beauty & Hygiene,"Many of us with fine, flat hair avoid using shampoo to keep our hair feeling light and looking full. But did you know that with a specially designed shampoo for fine hair you can get the look and feel of naturally voluminous, bouncy hair without sacrificing nourishment? The new Dove Oxygen Moisture s is here to add the difference to your hair. It is made with a transparent, lightweight formula that cleanses and moisturizes hair without weighing it down. Smooth, thicker looking and bouncy, let your hair love itself. Dove Oxygen Moisture Shampoo is designed for flat, fine hair. The nourishing system of Dove Oxygen Moisture Shampoo boosts hair with up to 95% more visible volume and fullness. Infused with Oxyfusion technology, this volumizing shampoo helps give the appearance of naturally bouncy hair that feels smooth and moisturized without being weighed down. Deeply conditioning, this nourishing shampoo for thin hair delicately cleanses and moisturizes strands to leave you with strong hair thats nourished, silky and smooth. Every wash gives your locks a moisturizing and volumizing boost, for touchably soft, smooth and beautiful hair. Based on a lab test of visible volume with Dove Oxygen Moisture system vs unclean hair.",630
506,"Almond Milk - Unsweetened, Lactose-Free, Plant-Based Milk Alternative",Gourmet & World Food,"Urban Platter Unsweetened Almond Milk contains Premium Almonds from California and mountain spring water from the Himalayas.

Make the switch to dairy-free deliciousness you never thought possible. Our Unsweetened original almond milk is infused with plant-based nutrition to keep you and your family healthy.

Every serving pours on 40% more calcium than dairy milk. Plus, our almond milk is naturally high in protein, low in fat and packed with vitamins and minerals.

Find yourself blown away by the creamy goodness. Pour it over your favourite cereal, add a dash of it to your coffee/tea or pair a glass of it with a warm cookie.

Urban Platter - Simply Good Food! :)",250
507,Herbal Vedaprash Immunity Booster,Beauty & Hygiene,"We at Vedapure believe in the complete natural herbal formulation to care for your overall health by providing nutrition which we miss in day to day life. The day-to-day illness which is common these days, vedaprash chyawanprash can help your body's immunity to fight them. Vedaprash is a great combination of extraordinary taste and exquisite ingredients.",649
508,"Table Ring - Trivet Round, Dia-13 cm","Kitchen, Garden & Pets","Easy to clean, durable prevets your dinning surface from getting damaged due to hot vessels. Easy to clean",59
509,Premium International Healthy Nutmix - Value Pack,Gourmet & World Food,"Confused about which nuts to take in your diet? Switch to Happilo Healthy Nutmix with an ultra-healthy combination of dry fruits, which give you your daily intake of nutrients. Time to be happy, lovely and healthy.",599
510,Non Scratch Sponge,Cleaning & Household,"Scotch-Brite Non Scratch Sponge is designed to help you with cleaning delicate utensils in your kitchen with care. The Non Scratch Scrub Sponge is a durable solution engineered with both, non woven crimped web and a sponge on either side. Now your glassware, non-stick cookware and other delicate utensils get non-scratch cleaning & the care they deserve!",70
511,Premium Care XXXL - 23 Diaper Pants,Baby Care,"Pampers baby-dry pants style diapers are the only pants in India with new Air Channels providing your baby with a new type of dryness overnight; breathable dryness. Magic Gel that locks wetness away for up to 12 hours of dryness. The new & improved product design enables a comfortable fit, closer to the baby’s body. Flexible waistband that adapts to baby’s movements for a comfortable fit. Baby lotion with Aloe Vera helps protect your baby’s delicate skin from diaper rash and irritation. A top layer with cotton-like soft material, for a comfortable night’s sleep. Fun exterior graphics; fun designs and characters to enjoy with your baby.",1149
512,Drumstick - Organically Grown,Fruits & Vegetables,"Fresho Organic products are organically grown and handpicked by expert.  Product image shown is for representation purpose only, the actually product may vary based on season, produce & availability.",16.25
513,Moisturzing Cream - Intense,Beauty & Hygiene,"Provide excellent moisture,balance,Provide excellent moisture balance.  For Beauty tips, tricks & more visit https://bigbasket.blog/",350
514,Shikakai - Amla and Bhringraj,Beauty & Hygiene,"Godrej Shikakai Amla Plus conditioning hair soap is enriched with normal ingredients, namely Shikakai, Amla and Bhringraj that cleanse condition and encourage your hair, keeping it spongy, smooth and shiny. It has Amla Plus conditioning that provides conditioning similar to shampoos. Godrej Shikakai with natural ingredients is a suitable and cheap way to have dirt free, shiny and strong hair.  For Beauty tips, tricks & more visit https://bigbasket.blog/",22
515,Amritsari Chhole Masala,"Foodgrains, Oil & Masala","Keya Khada Masala blends are whole spice mixes, hand-picked in the right proportion by expert chefs, gently blended and coarse ground to unlock its taste and aroma only while cooking. The magic of aroma-locked Amritsari Chhole Masala comes alive with flavourful bursts of real whole spices.",63
516,Meswak Toothpaste,Beauty & Hygiene,"Meswak is made from a rare herb, which grows slowly, resisting the brutal forces of nature amidst the sand dunes of Africa and South Asia. Even a small portion of this herb is capable to provide Complete Oral Care. Dabur brings to you, this herb in the form of Incredible Meswak Toothpaste. It is scientifically proven to help reduce tartar and plaque, fight germs and bacteria to keep gums healthy, helps prevent tooth decay, eliminate bad breath and ensure strong teeth, all at once to provide Complete Oral Care.",525
517,Tofu Supreme - Regular,"Bakery, Cakes & Dairy",soya paneer. Substitute to normal milk paneer with zero cholesterol & high protien. No Refrigeration Required.,120
518,Honey Sunflower,Gourmet & World Food,"Brighten your day with these sunflower seeds, chock-full of vitamin E and dripping with honey. Each handful of these sweet morsels is packed with nutritional goodness, satiating hunger and supplying health.",130
519,Premium Raw Organic Authentic Flaxseeds,Gourmet & World Food,"Happilo Natural Organic Flaxseed is your next smoothie mix-in, all-natural fibre substitute and healthy culinary secret! The facts about flax seeds, it provides a source of omega-3 and fibre and adds a pleasantly nutty flavour to everyday meals.Happilo provides food that is packed with the goodness of nature and taste that will keep you wanting for more. With a range of food items across categories like nuts, dry fruits, dried fruits, berries, seeds, mixed nuts, fusions, nut mix and other healthy items.Each of our products is not only 100% natural but is also made of 100% whole grains. While we stand strongly for health, wherein our products have a clear functional benefit, we believe that taste is the most important element when it comes to Snacks. We strive to bring the best range of snacks to you.",99
520,Ultra Protect Spray,Beauty & Hygiene,"Dr Rhazes Ultra Protect Hand Spray instantly kills 99.9% of germs, viruses and bacteria and gives your hands and surfaces non-stop protection for 2 hours, in spite of multiple touches. It contains 70% Ethanol and proprietary anti-microbial compounds that protect you from viruses and bacteria for 2 hours, even if you come in contact with infected surfaces or hands.
It is completely safe on the skin and Surfaces and does not require water. Dr Rhazes Ultra Protect Hand Spray has been designed and developed in Singapore and is Made in India.",400
