Product ID,Product Name,Category,Description,Price
752,Red Hot Anti Germ Mouthwash,Beauty & Hygiene,"New Closeup Red Hot Mouthwash is for long-lasting freshness. Powered by natural clove oil and anti-germ formula, it fights germs 24/7. This is bought to you from Closeup, India’s leading freshness brand in the toothpaste category. This mouthwash comes with natural clove oil and antigerm formula. The clove oil is for long-lasting fresh breath and the antigerm formula is for 100% mouth clean up that mints can’t do. Moment of closeness can happen anywhere anytime and you need the confidence to seize those moments but bad breath can kill this confidence.With the new Closeup, Red Hot Mouthwash have the confidence to seize the unexpected opportunities to get closer anytime anywhere. No alcohol formulation (refers to ethyl alcohol), it is 100% proven action against germs which fight germs 24/7 to give you long-lasting freshness. Made in India, it is marketed by Hindustan Unilever LTD (HUL).",230
753,Premium Eau De Toilette,Beauty & Hygiene,The Man Company Premium Eau De Toilette is the perfect choice for the party animal! Your party night look is incomplete without a fragrance that matches your style.,2199
754,"Coffee Roasters - Dark Vienna Roast, French Press",Gourmet & World Food,"Roast Level - Dark Grind Type -French Press 100% Specialty Grade Indian Arabica Coffee (No added flavour or preservatives). We source through direct trade relationships with India's best farms.
Tasting Notes: Cocoa, Oaky, Bitter Sweet
We freshly roast our coffee only after your order and grind it to suit your particular brewing method. We recommend Channi Grind If you don't have any coffee brewing equipment yet. Our mission since we started has stayed simple: introduce our customers to the estates we directly buy our great tasting coffee from, roast the beans with care, and make high-quality coffee more accessible through our cafes and our website. The coffee we roast is the coffee we like to drink, and we hope you like it too.",450
755,Pure Shilajit - Resin Form,Beauty & Hygiene,"Pure shilajit resin (semi-liquid) is the purest form of shilajit, with the benefits that are endless and provide a healthy body and mind.  Pure Shilajit resin is attained through a sophisticated all-natural process, sourcing the purest form of Shilajit from a location that is a well-guarded secret. It has a perfect concentration of essential minerals, nutrients like Fulvic Acid, Selenium that makes it the most exclusive Shilajit in the world and helps in achieving a balanced lifestyle. Pure Shilajit resin helps in boosting stamina and develop a healthy body and mind.",1450
756,Pickle - Chicken,Snacks & Branded Foods,Double Horse Pickle - Chicken 400 g,265
757,Taft Ultimate Hair Lacquer Ultimately Strong 6,Beauty & Hygiene,Taft hairspray Ultimate-6 offers the highest Taft fixation thanks to two combined polymers and also gives the hair a beautiful shine. This spray is great for all hair types and helps you get your desired hairstyle in a go. The strong hold feature of this hair styling lacquer will hold your desired hairstyle strong so that your hair does not need a touch-up or styling for every minute.,395
758,Vinegar - Apple Cider Vinegar + Garcinia,Gourmet & World Food,"UNFILTERED & Unpasteurized: Our Apple Cider Vinegar + Garcinia is unfiltered and unpasteurized infused with pure Garcinia and contains the purest form of vinegar called The Mother. To check the purity, hold the bottle against the light and you will see the liquid is hazy and contains fine strands of 'the mother' floating in the liquid.
APPLE CIDER VINEGAR FOR WEIGHT LOSS: This variant of our Apple Cider Vinegar with Mother is infused with Garcinia to help achieve your weight loss goals. All our Apple Cider Vinegars are made from real Himalayan Apples (not concentrates) that are sourced with great efforts so that only the purest forms reach you.
APPLE CIDER WITH GARCINIA: This product helps boost your metabolism and strengthens the digestive system. The infusion of Garcinia helps in weight loss and provides overall nutrition to your body. It helps lowering cholesterol levels and helps to keep your heart healthy.
FIGHT MID-MEAL CRAVINGS: Garcinia helps control untimely cravings and stops hunger pangs. It helps suppress appetite and gives you the feeling of fullness that helps you avoid binging. It blocks fat production and converts excess sugar into energy so that you stay active throughout the day.
DAILY DOSE OF 10ML: Since our Apple Cider Vinegars are pure and unpasteurised, they have a strong aroma and taste. We would recommend you to mix 10ml of our Apple Cider Vinegar+Garcinia with a glass of water and consume it on an empty stomach in the morning.",599
759,Baby Powder,Baby Care,"Johnson's baby powder absorbs excess moisture and keeps baby's skin comfortable and dry.
Johnson's baby powder is dermatologist tested and hypoallergenic.
U.S. Pharmacopoeia grade talc to ensure it meets the highest quality and purity.
Highest IFRA fragrance standard.
No Parabens, No Sulfates, No Dye.
Recommended by doctors.
Johnson's baby powder formula awakens and stimulates your baby's senses making your baby feel fresh and play happily with everyone.",235
760,Aloe 90% Soothing Gel,Beauty & Hygiene,"This soothing gel from Its Skin is formulated with 90% of fresh aloe, green tea, watermelon, and mango peel extracts. Aloe vera leaf extract with excellent hydration and soothing properties helps to soothe skin and also keeps the skin smooth and supple. This nongreasy moisturizer doesn't feel sticky on the skin and gives instant skin freshness",400
761,Assam Tea,Gourmet & World Food,"Tea Profile: TE-A-ME brings the season's fine Assam Tea, that extrudes the amber to orange liquor, which is strong and has exotic flavour profile from one of the region’s fine estates. This tea is known for its tart, malty flavor, vigorous body and bright color. Assam tea is the perfect tea to keep you warm on a rainy day or in a winter month. The variety is known to maintain your body warmth by slightly increasing your natural metabolism. With its higher caffeine content, Assam tea may help you to remain focused for an extended period of time and keep your mind alert and active. No added aromas, No added flavors, No artificial essences, Just pure tea! Our teas are 100% Natural, crafted by leading experts.
Fresher the tea is, Healthier it is. TE-A-ME tea bags are heat-sealed, processed and packaged at our own Factory. This process locks in the freshness.
All our tea bags are Staple Free - no more dangers of the metallic pins that may not only alter the health benefits of the tea but may also prove to be harmful.
We use the choicest of leaves from among the premium Tea Estates. We are passionate about every little detail of tea processing, right from tea Gardens to your Tea Cups. TE-A-ME Teas brings you a range of natural Black Teas to choose from- Assam Tea, Darjeeling, Earl Grey, English Breakfast- to suit your mood, your taste and your palette. Energize your day with this full-bodied cup of Assam tea, crafted by experts using fine handpicked black tea leaves from the lush valleys of Assam. The leaves are picked from Camellia sinensis plant. The name “Assam” tea comes from the geographical area in India from where it originated. TE-A-ME brings alive a wide spectrum of feelings, through a fascinating range of Iced Brews, Black Teas, Green Teas, Fruit and Flower Infusions. Our Teas are 100% natural, made with nature’s pure ingredients. Crafted by leading tea experts, who blend tea leaves handpicked from among the premium tea estates with select natural ingredients - we bring you the TE-A-ME range. We are part of the Madhu Jayanti family - a 75-year-old company with a legacy of producing fine teas that are consumed over 10 million times every day across 42 countries.",80
762,In-Shower Hair Removal Cream For Men & Women - Normal Skin,Beauty & Hygiene,"Veet Hair Removal In-shower cream with Silky Fresh technology helps you experience silk smooth skin with a delightful scent while removing hair effectively. It not only hydrates your skin for up to 24 hours but is also clinically proven to provide up to 7 days of smoothness. Veet In Shower has been designed to fit in with your busy routine: with a unique combination of water-resisting ingredients, it works while you shower so you can get on with your day. Our Normal Skin formula enriched with Lotus flower extract, known for its softening properties, gives you nourished the skin - and hair regrowth feels softer, too. Takes from 3 - 6 minutes.",450
763,Chicken Nuggets,Snacks & Branded Foods,"Sumeru brings you tasty chicken nuggets, made with chicken mince, which is well-seasoned and beaded to give you a snack that you can enjoy anytime with your family, friends, or just with yourself.",269
764,Organic - Pumpkin Seeds/Kumbalakayi Bija,"Foodgrains, Oil & Masala","These pumpkin seeds are abundant in protein, essential minerals and antioxidants. They are spiced and seasoned to make for a healthy yet tasty mid-meal snack. They are a rich source of minerals like manganese, phosphorus, magnesium, copper, zinc and iron and contain Vitamin E, which help prevent cardiac arrests and strokes and build immunity. They are rich in Omega-3 fatty acids, protein and antioxidants which makes them great for heart and liver health. Great and practical to carry on-the-go.
BB Royal is a premium brand of organic staples by Big Basket. The entire range of products is sourced from the best of farms and products to ensure high-quality standards. All BB Royal products are cleaned and packed in hygienic facilities in high-quality food-grade packaging. There is a no questions asked return policy on all BB Royal products in a bid to provide you nothing but the best!",475
765,Atlantic Salmon - Smoked  Presliced,"Eggs, Meat & Fish",Smoked & Pre sliced Salmon,1180
766,Evening Primrose Oil - Vegetarian Capsule (500 mg),Beauty & Hygiene,"This Product contains Evening Primrose Oil that is known to help relive premenstrual tension, Skin allergies and dryness, nourish Scalp, hair and also reduce joint inflammation and Stiffness.  For Beauty tips, tricks & more visit https://bigbasket.blog/",295
767,Beetroot - Julienne,Fruits & Vegetables,These edible ruby red roots are smooth and bulbous. Beetroots have the highest sugar content than any other vegetable. We deliver them fresh and uniformly sliced into thin long strips called the Julienne cut. Enjoy an effortless cooking that is less messy and much quicker because we value your time!,32.5
768,"Green Tea - Tulsi, Good Morning",Beverages,"Tulsi, popularly known as Queen of Herbs, is the most sacred herb in India. It is infused with great heating power. Tulsi has recognized for its high medicinal properties and has found it useful in treating cough, cold and vocal disorders. Prepared by master tea blenders and tasters at Wagh Bakri Tea Group, the unique blend of Tulsi and green tea boosts health and well-being round the year.",150
769,Fabric Conditioner - Rose Fresh,Cleaning & Household,"Makes clothes comfortably soft & freshner, easy ironing, less wrinkles",450
770,"Graphene Anion Day Use, L",Beauty & Hygiene,"COLLEEN INDIA'S 1st Graphene Anion Strip Sanitary Pad has Breathable layers that help to reduce menstrual cramps. It has a high absorbency and contains no toxins, perfumes, bleach. It leaves zero rashes and Itching. The enhanced embedded Graphene anion-chip negative ion and far-infrared ray function, within the sanitary napkins, inhibits the reproduction of anaerobic bacteria, micro-circulation, increases the growth of bio-enzyme, regulates acidic secretions in the vagina and improve women`s self-protection and disease prevention ability.
The surface of “Graphene Anion” sanitary napkin can absorb trice as much as the amount of fluid traditional sanitary napkin can. Sufficient hydrogel could hold the penetrated water in, instead of letting them side leak or backflow 360-degree wrapping with Edge-Lock leak-proof technology.",120
771,Istanbul Juice/Whisky Glass Tumbler,"Kitchen, Garden & Pets",This glass tumbler is made of tempered or toughened glassware for maximum safety of food service professionals as well as for the superior resistance and durability. Enhance the beauty of your in-house bar with this beautifully crafted crockery.,558
772,Organic - White Pepper,"Foodgrains, Oil & Masala","White pepper consists of only the inner seed with the pericarp removed by soaking and rubbing or by decorticating when dry. Its outer shrunken skin is rubbed off, exposing the dried, grayish-white pepper inside. Due to the anti-oxidant properties of pepper, it would promote the circulation of blood and oxygen in the skin making it more energized and fresh looking. It offers a tangy and spicy flavour when added to the preparations. White pepper is sharp in its taste and also has a pungent aroma.",75
773,Diet Chivda,Snacks & Branded Foods,"Garden Diet Chivda contains healthy ingredients and is well-known for its high purity, rich aroma, crispness and yummy taste. The delicious taste and low cholesterol content makes this chivda wonderful for evening coffee or tea.",50
774,Chilli Garlic Aioli Dip,Snacks & Branded Foods,"Chilli Garlic Dip is one that excites everyone. Its has chunks of green chillies, garlic and a surprise of Mustard. All That Dips Aioli are creamy, rich and full of flavours. You can use as a dip, spread or as an ingredient in your cooking adventure.",200
775,Jasmine Heart Bath Personal Care Gift Set,Beauty & Hygiene,"Gift yourself or your loved ones Soulflower Jasmine Heart Bath set. Soulflower bath & body products provide you with your very own spa at home. The products range in our gift set are formulated by combining precious essential oils with the blend of natural and organic ingredients. The idea behind the whole creation is to provide you and your dear ones the natural and vegan skincare products which are healthy, regenerating and maintain body and skin balance.This aroma gift set was specially designed for those who love the richness of jasmine aroma and want to fully immerse in its exotic experience or want to gift their loved ones a mind alluring bath set. Each gift sets come in an attractive, colourful and handcrafted heart-shaped gift box to give to someone special containing Jasmine Aroma Massage Oil, Bhringraj Natural Oil, Jasmine Night Soap, Jasmine Aroma Potpourri, Jasmine Festive Big T-Light Aroma candles, Neck Roller and a Loofah.",2000
776,"Loofah/Sponge Scrubber/Body - Pink, BH-064D PNK",Beauty & Hygiene,"Remove all the dirt and exfoliate your skin as you use this pink loofah scrubber. It is composed using a microfiber cloth, which helps in forming great lather and cleanses the skin making it look smooth and gleaming. This loofah/scrubber is fashioned in a hand glove shape for convenient use.",189
777,Safe Sun Kids Sun Block Cream - SPF 25,Beauty & Hygiene,Spare your children from the searing sun by applying them Lotus Herbals Safe Sun Kids Sun Block Cream with SPF-25. It contains concentrates of chamomile blossoms for mitigating and supporting a youngsters skin. Gives complete UVA and UVB assurance for tan and sun blaze counteractive action. Tried for utilization by pediatricians and dermatologists. It consists of Chamomile Extract which has anti-provocative & alleviating properties which is useful for touchy skins. It provides complete UVA and UVB protection for tan and sunburn prevention. It is specially formulated for young and delicate skin that soothes and nourishes a childs skin. Protect the skin of your child from solar radiations using Lotus Herbals Safe Sun Kids Sun Block Cream with SPF 25.,335
778,Pasta & Pizza Sauce - No Onion & No Garlic,Snacks & Branded Foods,Experience the full flavour of pasta-pizza sauce without any onion or garlic. It is made from 38% fresh tomatoes and herbs. Use it as a dressing or a dip sauce.,89
779,Soap Case - Glory,Beauty & Hygiene,"OurÂ Soap DishÂ is made of plastic infused with Microban which inhibits the growth of odor- and stain-causing bacteria  For Beauty tips, tricks & more visitÂ https://bigbasket.blog/",85
780,Peanut Butter - Chunky,Gourmet & World Food,,299
781,Skin Gel - Under Eye,Beauty & Hygiene,"Richfeel Under Eye Gel helps reduce fine lines. A soothing, revitalizing gel to counteract the effects of stress on the eyes. It is enriched with aromatic extracts of peach and plant extracts of badiaga.",189
782,"Honey Comb Touch Non-Stick Flat Tawa - 260 mm, Black","Kitchen, Garden & Pets","Nirlon Non-Stick Cookware with honeycomb structure is a premium product offering in the Flat Tawa category. This Flat Tawa is 5 layer cookware with Inner Surface Centre; Virgin Aluminum, Outer Compatible Aluminum. Its unique honeycomb design makes it metal spoon friendly and ensures prolonged non-stick performance compare to other non-stick cookware. It is more efficient than any aluminium cookware in terms of even-heat distribution, little or no hot spots and comes with 260 mm base thickness.",799
783,"Face Mask - Pro Tech 95, 6 layered, Medium, MK18003",Beauty & Hygiene,"T-base mask 6 layered reusable cotton fabric mask, Nose wire across the top of the mask allows it to be contoured over the nose for a better fit and protection against germ spread, soft elastic earloops for extra comfort. Available in an assortment of exclusively print and colours, extremely breathable fabric, washable and reusable.",299
784,Hand Soap - Lavender & Chamomile,Beauty & Hygiene,"Calm Restore Refresh Made in Malaysia. Content - 500ml. pH - 5.5. Designed to gently cleanse and leave skin feeling refreshed. Delicately scented with a refreshingly Lavender & Chamomile.  For Beauty tips, tricks & more visitÂ https://bigbasket.blog/",225
785,Durum Wheat Pasta- Penne Rigate 500 g Carton + Pasta Sauce- Arrabbiata 400 g Jar,Gourmet & World Food,"Barilla Penne Rigate is one of the most versatile pasta, known for its adaptability with recipes and occasions, from a traditional family lunch or official grown dinner. Try Penne Rigate with easy tomato sauce, vegetables, with or without meat and enjoy an authentic Italian meal.Feature: It is made with 100% durum wheat semolina, GMO free. It has no maida. Nutrients: Excellent source of energy, naturally low in fat with a low glycemic index that keeps you fuller for longer. Trusted: Made in Italy with over 140 years of craftsmanship, making high quality pasta that cooks perfectly every time. Barilla arrabbiata combines carefully selected fresh tomatoes, garlic, and parsley with a tantalizing touch of crushed green chili peppers to create authentic Italian meals with a memorable kick. Simply combine with your favourite pasta for a delicious meal.FEATURE: Made from the highest quality vine-ripened Italian tomatoes and real chilies. It is suitable for vegetarian, vegan and gluten-free users.NUTRIENTS: Prepared like home-made Italian recipe, contains all-natural ingredients, no added preservatives.TRUSTED: Made in Italy, with over 140 years of craftsmanship, making high-quality pasta.",598
786,Oil - Gingelly,"Foodgrains, Oil & Masala","Idhayam Gingelly Oil guarantees you the best health by pushing your Blood Pressure down, lowering your Cholesterol and maintains your skin healthy. It's soft for heart that adds zest to the cuisine. Sesame oil offers good oral health too. Furthermore it shows its major significance in stuffs like marinades, sauces, vinaigrettes and dressings that suggests you good flavor along with good health.",299
787,Ragi - Whole,"Foodgrains, Oil & Masala","For 1 Cup Serving : Calories - 286 g,Fat - 2.0 g",60
788,"Capsules - Shilajit Gold for Strength, Stamina & Power",Beauty & Hygiene,"Dabur Shilajit Gold, a 100% Ayurvedic formulation for effective strength & stamina.

With pure Shilajit for Power, and enriched with Gold for Stamina, Kesar for Strength, Ashwagandha for Energy, Safed Musli to Counter Weakness. Dabur Shilajit Gold is a unique combination of Shilajit, Gold, Kesar and other important herbs like Ashwagandha , Kaunch Beej and Safed Musali. Shilajit Gold is good for general health and helps increase strength, stamina and vigor.

Recommended dosage (Adults) is One Capsule twice a day or as directed by Physician preferably with milk.

Benefits of its ingredients : 

Shilajit:

• Brings about balanced and harmonious health.

• It acts as a restorative tonic, helps in recovery of wear and tear of body tissues, helps to improve strength, stamina, vigour & power.

Gold:

• Helps to increase strength, improves vigour and physical endurance

Saffron:

• Nutritious & has anti-fatigue property  For Beauty tips, tricks & more visitÃ‚ https://bigbasket.blog/",430
789,100% Melamine 3D Soup Spoon - Blue,"Kitchen, Garden & Pets","Iveos soup spoons are used to stir and drink the soups. It is made to consume soup or the soup made with particles of solid food, such as meat, vegetables, grains, and pasta. A soup spoon is a type of spoon with a large or rounded bowl, used for consuming soup. The term can either refer to the British soup spoon or the Chinese spoon. Round bowled soup spoons were a Victorian invention.",264
790,Signature Gold Dark Vanilla & Oud Wood Perfume,Beauty & Hygiene,"The World’s # 1 Male Deodorant Axe, presents ‘Axe Signature Gold’ Ultra Premium Perfumes. A range of fine fragrances that are packaged in beautiful and stylish matte glass bottles. Designed by the world’s leading perfumers, each Axe Signature Gold fragrance is specially crafted with some of the world’s most exotic and refined ingredients to bring out what’s unique in you. A suave and warm, woody fragrance that will play with your senses. One moment it’s tart mandarin, the next warm oud, then the sweet scent of vanilla before diving into a dark and smoky cloud of tobacco. This unique blend of fragrance notes will mesmerise you. Make every special occasion extra special with Axe Signature Gold Dark Vanilla and Oud Wood Perfume. Spray it on your pulse points, the heat generated by your pulse intensifies the fragrance and amplifies its projection. Add that extra twist to your style. With this perfume, you’ll make an impression that lingers on. Catch attention and arouse curiosity in the moments that count. Rich, mesmerising fragrances in a slick and elegant glass bottle, the Axe Signature Gold range of ultra-premium perfumes is also a perfect gift for your loved ones.Features:, Fine fragrance in a beautifully crafted matte glass bottle., Premium long lasting fragrance crafted with unique exotic ingredients., Key Ingredients: Dark Vanilla & Royal Oud Wood., Suave & warm woody fragrance., Safe on skin.",450
791,"Super Moist Cake Mix - Yellow, Imported",Gourmet & World Food,"Bowl to oven in minutes. Thank you for welcoming us into your home. We hope what’s inside this box helps you bring more love to your table. Cordially yours, Betty Crocker's super moist yellow cake mix is made with no preservatives and no artificial flavours. Just seven ingredients in the box. Bowl to oven in minutes. Makes one 13"" x 9"" pan. The red spoon is my promise of great taste, quality and convenience.
1. Cake Mix an ideal treats sweet Dessert that enjoyment your taste buds.
2. Cake Mix is a tasty, simple & quick solution for mothers to pamper their kids and family.
3. A sweet companion to your evening tea.",445
792,"Organic Pure Sweetener Blend - 1:4 Sugar Replacement Powder, Unbleached",Gourmet & World Food,"Sweetness in our superfood blend comes from organic green Stevia leaf powder (0 carbs & calories), blended with naturally nutrient-rich organic coconut sugar (GI=35, much lower than jaggery/dates). Our special blend gives you the satisfaction and satiety of eating sugar without empty carbs and addiction. Using selective ‘no nasty’ organic, ultra-low GI, nutrient-dense, slow-releasing ingredients, this superfood leaves you feeling satisfied! Plant-Based Healthy Sweetener Blend 1:4.",499
793,"100% Whey Protein, Rich Chocolate",Beauty & Hygiene,"IN2 Whey Protein is an Ultra-Premium Muscle Building Protein Powder. This protein powder features multiple quality whey proteins resulting in a nutritious and multi-functional protein supplement that enables a superior bioavailable protein source for athletes. Whey is considered to be the best source of protein due to its high Biological Value (BV), Amino acid profile and fast absorption to give your body what it needs to build muscle and recover. IN2 Whey Protein uses a superior cold microfiltration process to guarantee a higher quality Whey Protein.",2000
794,Chemba Puttu Podi,"Foodgrains, Oil & Masala","Red Rice or chemba Podi is a vegetarian promise and it will be a perfect treat to your taste buds. It contains iron, vitamin E, protein, antioxidants, and other essential nutrients. This steamed food has a rich taste and flavour. Relish the soft and tasty Red Rice for your breakfast.",145
795,Ratnagiri Alphonso,Beverages,The new B Natural Transparent Range presents the most authentic indulgence of Mango. The Alphonso Mango is sourced from Ratnagiri to provide the best mango experience and the goodness of B Natural's new range of bottled beverages. And what's more? This beverage is made from 100% Indian fruits and not from concentrate.,120
796,Water Wiper - Nano,Cleaning & Household,"The Milton Spotzero Steel handle wiper is safe on all surfaces. The base of the product is made from rubber, which makes it easier to push water along the floor. The handle has a loop for hanging. This product is made from high-grade material which ensures long lasting life.",149
